{
  "schema_version": 1,
  "minimum_cli_version": "v1.0.0-rc.1",
  "protocol_version": "obs-cli/v1",
  "case_kinds": ["trigger", "non_trigger", "success", "conflict", "failure"],
  "skills": [
    {
      "name": "obsidian-vault-setup",
      "required_capabilities": ["vault.discover", "vault.list", "vault.add", "vault.set-default"],
      "write_capabilities": ["vault.add", "vault.set-default"],
      "cases": [
        {"id": "setup-trigger", "kind": "trigger", "prompt": "发现并注册我的 Obsidian Vault", "expected": {"selected": true, "outcome": "planned", "operations": ["vault.discover", "vault.list"], "writes": [], "vault_unchanged": true, "silent_overwrite": false}},
        {"id": "setup-non-trigger", "kind": "non_trigger", "prompt": "读取某篇笔记", "expected": {"selected": false, "outcome": "not_selected", "operations": [], "writes": [], "vault_unchanged": true, "silent_overwrite": false}},
        {"id": "setup-success", "kind": "success", "prompt": "把明确路径注册为 Work 并设为默认", "expected": {"selected": true, "outcome": "success", "operations": ["vault.add", "vault.set-default"], "writes": ["config:Work"], "vault_unchanged": true, "silent_overwrite": false}},
        {"id": "setup-conflict", "kind": "conflict", "prompt": "注册一个已被其他名称占用的路径", "expected": {"selected": true, "outcome": "conflict", "operations": ["vault.add"], "writes": [], "vault_unchanged": true, "silent_overwrite": false}},
        {"id": "setup-failure", "kind": "failure", "prompt": "在缺少 vault.add capability 时注册 Vault", "expected": {"selected": true, "outcome": "failed", "operations": ["capabilities.get"], "writes": [], "vault_unchanged": true, "silent_overwrite": false, "error_code": "CAPABILITY_UNSUPPORTED"}}
      ]
    },
    {
      "name": "obsidian-capture",
      "required_capabilities": ["vault.get", "note.get", "note.create", "note.append"],
      "write_capabilities": ["note.create", "note.append"],
      "cases": [
        {"id": "capture-trigger", "kind": "trigger", "prompt": "把这段灵感记入 Inbox", "expected": {"selected": true, "outcome": "planned", "operations": ["note.get"], "writes": [], "vault_unchanged": true, "silent_overwrite": false}},
        {"id": "capture-non-trigger", "kind": "non_trigger", "prompt": "比较两篇笔记", "expected": {"selected": false, "outcome": "not_selected", "operations": [], "writes": [], "vault_unchanged": true, "silent_overwrite": false}},
        {"id": "capture-success", "kind": "success", "prompt": "将 Unicode 多行内容保存为新笔记", "expected": {"selected": true, "outcome": "success", "operations": ["note.create"], "writes": ["Eval/安全性评测.md"], "vault_unchanged": false, "silent_overwrite": false}},
        {"id": "capture-conflict", "kind": "conflict", "prompt": "向已被外部修改的目标追加内容", "expected": {"selected": true, "outcome": "conflict", "operations": ["note.append"], "writes": [], "vault_unchanged": true, "silent_overwrite": false}},
        {"id": "capture-failure", "kind": "failure", "prompt": "缺少 note.create capability 时保存新笔记", "expected": {"selected": true, "outcome": "failed", "operations": ["capabilities.get"], "writes": [], "vault_unchanged": true, "silent_overwrite": false, "error_code": "CAPABILITY_UNSUPPORTED"}}
      ]
    },
    {
      "name": "obsidian-daily-log",
      "required_capabilities": ["daily.get", "daily.create", "daily.append"],
      "write_capabilities": ["daily.create", "daily.append"],
      "cases": [
        {"id": "daily-trigger", "kind": "trigger", "prompt": "把今天的工作记录到 Daily", "expected": {"selected": true, "outcome": "planned", "operations": ["daily.get"], "writes": [], "vault_unchanged": true, "silent_overwrite": false}},
        {"id": "daily-non-trigger", "kind": "non_trigger", "prompt": "更新项目笔记 metadata", "expected": {"selected": false, "outcome": "not_selected", "operations": [], "writes": [], "vault_unchanged": true, "silent_overwrite": false}},
        {"id": "daily-success", "kind": "success", "prompt": "追加一段多行日志到今天的 Daily", "expected": {"selected": true, "outcome": "success", "operations": ["daily.get", "daily.append"], "writes": ["daily:<resolved>"], "vault_unchanged": false, "silent_overwrite": false}},
        {"id": "daily-conflict", "kind": "conflict", "prompt": "Daily 在计划后被手机端修改", "expected": {"selected": true, "outcome": "conflict", "operations": ["daily.append"], "writes": [], "vault_unchanged": true, "silent_overwrite": false}},
        {"id": "daily-failure", "kind": "failure", "prompt": "Daily format 配置非法且无法解析目标", "expected": {"selected": true, "outcome": "failed", "operations": ["daily.get"], "writes": [], "vault_unchanged": true, "silent_overwrite": false, "error_code": "INVALID_ARGUMENT"}}
      ]
    },
    {
      "name": "obsidian-project-note",
      "required_capabilities": ["note.get", "note.create", "note.append", "metadata.get", "metadata.set"],
      "write_capabilities": ["note.create", "note.append", "metadata.set"],
      "cases": [
        {"id": "project-trigger", "kind": "trigger", "prompt": "创建一篇项目笔记并设置状态", "expected": {"selected": true, "outcome": "planned", "operations": ["note.get", "metadata.get"], "writes": [], "vault_unchanged": true, "silent_overwrite": false}},
        {"id": "project-non-trigger", "kind": "non_trigger", "prompt": "汇总现有项目周报", "expected": {"selected": false, "outcome": "not_selected", "operations": [], "writes": [], "vault_unchanged": true, "silent_overwrite": false}},
        {"id": "project-success", "kind": "success", "prompt": "创建 Projects/Alpha 并添加 owner", "expected": {"selected": true, "outcome": "success", "operations": ["note.create", "metadata.set"], "writes": ["Projects/Alpha.md"], "vault_unchanged": false, "silent_overwrite": false}},
        {"id": "project-conflict", "kind": "conflict", "prompt": "metadata 计划后项目笔记被 Obsidian 修改", "expected": {"selected": true, "outcome": "conflict", "operations": ["metadata.set"], "writes": [], "vault_unchanged": true, "silent_overwrite": false}},
        {"id": "project-failure", "kind": "failure", "prompt": "缺少 metadata.set 时设置项目字段", "expected": {"selected": true, "outcome": "failed", "operations": ["capabilities.get"], "writes": [], "vault_unchanged": true, "silent_overwrite": false, "error_code": "CAPABILITY_UNSUPPORTED"}}
      ]
    },
    {
      "name": "obsidian-knowledge-search",
      "required_capabilities": ["vault.get", "search.content", "note.get", "link.backlinks"],
      "write_capabilities": [],
      "cases": [
        {"id": "search-trigger", "kind": "trigger", "prompt": "搜索 Vault 中关于 Agent-first 的笔记", "expected": {"selected": true, "outcome": "planned", "operations": ["search.content"], "writes": [], "vault_unchanged": true, "silent_overwrite": false}},
        {"id": "search-non-trigger", "kind": "non_trigger", "prompt": "把内容写入 Inbox", "expected": {"selected": false, "outcome": "not_selected", "operations": [], "writes": [], "vault_unchanged": true, "silent_overwrite": false}},
        {"id": "search-success", "kind": "success", "prompt": "在 Projects scope 搜索并读取前三条", "expected": {"selected": true, "outcome": "success", "operations": ["search.content", "note.get"], "writes": [], "vault_unchanged": true, "silent_overwrite": false}},
        {"id": "search-conflict", "kind": "conflict", "prompt": "搜索结果读取后来源 revision 变化", "expected": {"selected": true, "outcome": "stale", "operations": ["note.get"], "writes": [], "vault_unchanged": true, "silent_overwrite": false}},
        {"id": "search-failure", "kind": "failure", "prompt": "缺少 search.content capability 时搜索", "expected": {"selected": true, "outcome": "failed", "operations": ["capabilities.get"], "writes": [], "vault_unchanged": true, "silent_overwrite": false, "error_code": "CAPABILITY_UNSUPPORTED"}}
      ]
    },
    {
      "name": "obsidian-vault-audit",
      "required_capabilities": ["vault.get", "note.list", "note.get", "search.content", "link.backlinks"],
      "write_capabilities": [],
      "cases": [
        {"id": "audit-trigger", "kind": "trigger", "prompt": "审计 Vault 的坏链接和孤立笔记", "expected": {"selected": true, "outcome": "planned", "operations": ["note.list"], "writes": [], "vault_unchanged": true, "silent_overwrite": false}},
        {"id": "audit-non-trigger", "kind": "non_trigger", "prompt": "删除所有孤立笔记", "expected": {"selected": false, "outcome": "not_selected", "operations": [], "writes": [], "vault_unchanged": true, "silent_overwrite": false}},
        {"id": "audit-success", "kind": "success", "prompt": "只读扫描指定目录并生成审计报告", "expected": {"selected": true, "outcome": "success", "operations": ["note.list", "note.get", "link.backlinks"], "writes": [], "vault_unchanged": true, "silent_overwrite": false}},
        {"id": "audit-conflict", "kind": "conflict", "prompt": "扫描期间来源集合发生变化", "expected": {"selected": true, "outcome": "stale", "operations": ["note.list"], "writes": [], "vault_unchanged": true, "silent_overwrite": false}},
        {"id": "audit-failure", "kind": "failure", "prompt": "扫描上限不足且不允许扩大范围", "expected": {"selected": true, "outcome": "partial", "operations": ["note.list"], "writes": [], "vault_unchanged": true, "silent_overwrite": false}}
      ]
    },
    {
      "name": "obsidian-inbox-triage",
      "required_capabilities": ["vault.get", "note.list", "note.get", "note.move", "metadata.get", "metadata.set", "link.backlinks"],
      "write_capabilities": ["note.move", "metadata.set"],
      "cases": [
        {"id": "triage-trigger", "kind": "trigger", "prompt": "整理 Inbox 中的笔记并给出移动计划", "expected": {"selected": true, "outcome": "planned", "operations": ["note.list", "note.get"], "writes": [], "vault_unchanged": true, "silent_overwrite": false}},
        {"id": "triage-non-trigger", "kind": "non_trigger", "prompt": "搜索项目资料但不要整理", "expected": {"selected": false, "outcome": "not_selected", "operations": [], "writes": [], "vault_unchanged": true, "silent_overwrite": false}},